main_option,secondary_option,advantage
PG,SG,"Rapidez en la transición, Versatilidad ofensiva"
SG,SF,"Presión constante sobre la defensa, Capacidad de crear y terminar jugadas, Buena capacidad defensiva"
SF,SG,"Presión constante sobre la defensa, Capacidad de crear y terminar jugadas, Buena capacidad defensiva"
PF,SF,"Versatilidad en cambio de defensores, Equipo versátil y difícil de desbordar en defensa, Combinación de tiro y juego muy efectiva"
C,PF,"Presencia física en la pintura, Dominio del juego bajo el aro, Ideal para proteger zona defensiva y asegurar rebotes ofensivos/defensivos"